{"bundle_sha256":"sha256:6bf8aeadb6a61bdf2fd2392b53dbf02e55f63d1d9f5b3d7cf034119404400dda","exporter":{"argv":["credit-audit","export","--run","run_4a7b59f3c66d"],"deterministic":true,"python":"3.14.5rc1","version":"1.0.0"},"git":{"commit":"14fb8fb026a4e2a1cb5cee4ab80b3f8caed72d4e","dirty":true,"tag":null},"hash_functions":{"content_ids":"blake2b-128","integrity_manifest":"sha256","rationale":"blake2b-128 addresses internal records because the pipeline hashes a great many small objects and speed matters there. sha256 signs the published manifest because `shasum -a 256 -c` exists on every machine a skeptic might use. Two functions, two jobs."},"inputs":[{"in_repo":true,"path":"src/credit_audit/policy/policy.md","role":"policy_prose","sha256":"sha256:624cfc922e063685264d81c6f535b8494f24ee42240b2557a7f5cce610c7411f"},{"in_repo":true,"path":"src/credit_audit/policy/policy.yaml","role":"policy_machine","sha256":"sha256:2d8659f8618233c80cf1bf38c16fe3091e55d6dabf18af52b997c4264741ada9"},{"in_repo":true,"path":"src/credit_audit/profiles/fixtures/profiles.jsonl","role":"profiles","sha256":"sha256:01cf6b6410ff724e774ad21220436a41bd15c08f6de382aa012a89bc014df9bb"},{"in_repo":true,"path":"src/credit_audit/suites/core.yaml","role":"suite","sha256":"sha256:4e7b275c09f32c8e7bc858ee9ff8c273904d2bb6c2ad76eba1bf3b757782916a"},{"frozen_before_run":true,"git_tag":"prereg-v1","in_repo":true,"path":"src/credit_audit/stats/PREREGISTRATION.yaml","role":"preregistration","sha256":"sha256:ead54bebaf952bd44023bd9404f56275a547135b830c627d759c36c7ce3bcd95","tagged_at":"2026-08-13T19:14:06+00:00"}],"run_id":"run_4a7b59f3c66d","schema":"credit-audit/integrity@1","source_artifacts":[{"bytes":76571438,"download":null,"in_repo":false,"lines":5280,"path":"runs/run_4a7b59f3c66d/trajectories.jsonl","regenerate":null,"sha256":"sha256:b142df7abb00c97387e19dcc271f5e4c2ff0a1b31cda4b9f970361d219c747b7"},{"bytes":1205626,"download":null,"in_repo":false,"lines":888,"path":"runs/run_4a7b59f3c66d/results.jsonl","regenerate":null,"sha256":"sha256:dd5e7cf393c6502fbcccaa6b706530a7f02eb10842b5cdfaffeade668f63a204"},{"bytes":654549,"download":null,"in_repo":false,"lines":511,"path":"runs/run_4a7b59f3c66d/applicants.jsonl","regenerate":null,"sha256":"sha256:df6101c9fc216261fd8b90f3b2b57d13c0f4816a0e321a1b1a24656dee2c797e"},{"bytes":886905,"download":null,"in_repo":false,"lines":1056,"path":"runs/run_4a7b59f3c66d/interventions.jsonl","regenerate":null,"sha256":"sha256:390c72593104b7e089daeaf9d5951fc5b5f2bb1ce9e9e821e0c74a271b1b8810"}],"verify":[{"claim":"Every file in this bundle matches the hash published beside it.","cmd":"cd web/public/runs/run_4a7b59f3c66d && shasum -a 256 -c integrity/SHA256SUMS"},{"claim":"Re-running the exporter produces this bundle byte for byte.","cmd":"credit-audit export --run run_4a7b59f3c66d --out /tmp/recheck && diff -r /tmp/recheck/run_4a7b59f3c66d web/public/runs/run_4a7b59f3c66d"},{"claim":"Every published statistic re-derives from the raw run artifacts.","cmd":"credit-audit verify --run run_4a7b59f3c66d --strict"},{"claim":"The run itself reproduces from this commit at zero API cost.","cmd":"git checkout 14fb8fb026a4 && credit-audit run --suite core --model gemini-2.5-flash-lite --seed 1729"}]}
